{
  "$ref": "#/definitions/resources",
  "definitions": {
    "resources": {
      "type": "array",
      "items": {
        "type": "object",
        "properties": {
          "id": {
            "type": "string",
            "pattern": "^[a-z][a-z0-9_]*$"
          },
          "name": {
            "type": "string",
            "minLength": 1
          },
          "desc": {
            "type": "string",
            "default": ""
          },
          "notes": {
            "type": "string",
            "default": ""
          },
          "icon": {
            "type": "string",
            "default": ""
          }
        },
        "required": [
          "id",
          "name"
        ],
        "additionalProperties": false
      }
    }
  },
  "$schema": "http://json-schema.org/draft-07/schema#"
}
